{
  "request_id": "demo-001",
  "mode": "rewrite",
  "status": "ok",
  "conclusion": "最大问题是开头只有泛泛评价，没有说明这次测试和目标用户的具体关系。",
  "protected_elements": [
    {
      "type": "experience",
      "text": "作者亲自试了一个新的 AI 工具",
      "reason": "这是输入中唯一明确的真实经历"
    }
  ],
  "scores": {"topic_80": null, "audit_60": null},
  "bottleneck": {
    "stage": "stop",
    "quote": "最近我试了一个新的 AI 工具。",
    "reason": "没有具体结果或问题，目标用户缺少继续听的理由"
  },
  "retain": ["作者亲自测试的事实"],
  "change": [
    "删除无法证实的“特别强”",
    "把“全面提升效率”改为与重复资料有关的具体使用目的",
    "去掉“今天给大家分享一下”的空铺垫"
  ],
  "priority_change": "先让第一句直接指出目标用户正在处理的重复工作。",
  "observations": ["原文没有工具名称、耗时或量化结果"],
  "inferences": ["泛化评价可能降低前几秒停留，因为用户尚不知道内容与自己有什么关系"],
  "rewrite": {
    "strategy": "保留亲测事实，不补造结果，用目标用户的重复工作切入。",
    "before_after": [
      {
        "before": "最近我试了一个新的 AI 工具。",
        "after": "如果你每天都在重复整理资料，这个测试你可以先看一下。",
        "reason": "先建立用户相关性"
      }
    ],
    "final_draft": "如果你每天都在重复整理资料，这个测试你可以先看一下。\n\n我最近确实试了一个新的 AI 工具。先不说它有多强，因为我手上还没有能公开的量化结果。\n\n我更想讲清楚一件事：它到底能不能接住那些重复、又特别耗人的资料处理。",
    "second_check": "开头的用户相关性已经增强；没有新增工具名称、耗时、收益或用户反馈，作者亲测的事实得到保留。"
  },
  "comparison": null,
  "next_experiment": null,
  "caveats": ["缺少真实测试结果，因此不能声称效率已经提升"]
}

